Product ID,Product Title
6864172908742,82 Tee
6958393753798,Adams Stretch Tank Top - Kaikki värit
7081623748806,Addison Drop Armhole Tank Top
7081569779910,Akron Backpack - Black
7069905912006,Alabama Drop Crotch Shorts
7666878480582,Albany Backpack - Kaikki värit
7215844262086,Alexandria Hoodie - Black
6856728314054,Annapolis Work Out Legging - Kaikki värit
7265076904134,Atlanta Shorts
7068619702470,Aurora Set
6968951767238,Austin T-Shirt
7068627796166,Banks Set
7060631945414,Benton Track Pants
7069887135942,Benton Track Shorts
7081593864390,Bixby Oversized T-Shirt
6856718713030,Body Warmer 82
6968989974726,Boise Oversized Long Sleeve
7215833350342,Boxing Reflex Ball - Black/Red
7081567551686,brighton bag
7058207146182,Bristol Fitted Cap
6856720842950,Brooklyn knitted sneakers - Black/White
6856721039558,Brooklyn knitted sneakers - Red/Black
6856728969414,Camden T-shirt - Pink
6958393327814,Carter Stretch Tank Top - Kaikki värit
7081575088326,Charlotte Hoodie
6856723366086,Chicago High Tops - Kaikki värit
7069791682758,Classic Hoodie
6856731918534,Classic Seersucker Pants
6969015009478,Classic Sports Bottle - Black/Red 750ML
6856724840646,Classic Work Out Top - Kaikki värit
6856725233862,Classic Zipped Hoodie - Kaikki värit
7068633137350,Cleveland Set
6856725594310,Colorado Oversized T-shirt Black/Gray
7080256897222,Columbus Men's Tights
7609467011270,Crowley Men's Oversized Hoodie
7238677823686,Dallas Wrist Wraps Gloves - Black/Blue
7238678413510,Dallas Wrist Wraps Gloves - Black/Red
7238679265478,Dallas Wrist Wraps Gloves - Black/Red Stitched
6968924242118,Davis T-Shirt
7265081131206,Dayton T-Shirt
7264780124358,Destin Swim Shorts
6856725659846,Disturbed Jacket Gray Melange
7629295812806,Dorris Leggings
6968936562886,Dover Oversized T-Shirt
7081569091782,Duncan Backpack - Army Green
7081589080262,Elmira V-Neck T-Shirt
6856726249670,Essential V-Neck T-Shirt - Kaikki värit
7081629253830,Estelle Twisted Crop Top
6968928600262,Fargo T-Shirt
7629299712198,Figure 8 Lifting Straps - Black
6856729002182,Florence Tank Top - Kaikki värit
6968918900934,Fremont T-Shirt
6856731164870,Get An Attitude Tee
7068635627718,Glendo Set
7189335769286,Gorilla Wear 4 Inch Leather Lever Belt
7189339242694,Gorilla Wear 4 Inch Leather Lifting Belt
6856726511814,Gorilla Wear 4 Inch Nylon Belt - Musta/Harmaa
6856726675654,Gorilla Wear 4 Inch Padded Leather Belt - Musta
7058257838278,Gorilla Wear 4 Inch Women's Lifting Belt
7594369122502,Gorilla Wear 82 Baseball Jersey - Kaikki värit
6856729624774,Gorilla Wear 82 Jersey - Kaikki värit
7200193839302,Gorilla Wear Akron Backpack - Musta
6856717664454,Gorilla Wear Alabama Drop Crotch Joggers
7157979971782,Gorilla Wear Alaska Neck Warmer - Kaikki värit
6856727560390,Gorilla Wear Albin Shorts - Musta
6856730050758,Gorilla Wear Alexsandria Hoodie - Musta
7265078149318,Gorilla Wear Alice Shorts - Kaikki värit
7655296073926,Gorilla Wear Ankle Socks 2-Pack - Kaikki värit
6856731525318,Gorilla Wear Ashton Pro Boxing Gloves
6856732082374,Gorilla Wear Aspen T- Shirt - Kaikki värit
6856732278982,Gorilla Wear Aspen Tank Top - Kaikki värit
6856726806726,Gorilla Wear Athlete Oversized Shorts - Musta
6856732344518,Gorilla Wear Athlete Shirt 2.0 - Kaikki urheilijat
6856727232710,Gorilla Wear Athlete T-Shirt - Kaikki värit
6856719696070,Gorilla Wear Augustine Old School Pants - Kaikki värit
6856720089286,Gorilla Wear Augustine Old School Shorts - Kaikki värit
6856720646342,Gorilla Wear Augustine Old School Work Out Top - Kaikki värit
6856728543430,Gorilla Wear Aurora Bra - Harmaa
6856728641734,Gorilla Wear Aurora Tights - Harmaa
6856718090438,Gorilla Wear Austin Tank Top - Kaikki värit
6856718319814,Gorilla Wear Bailey Shorts - Kaikki värit
6856724086982,Gorilla Wear Ballinger Track Pants - Kaikki värit
6856733425862,Gorilla Wear Banks Oversized Hoodie - Kaikki värit
6856733851846,Gorilla Wear Banks Sweatpants - Kaikki värit
6856728805574,Gorilla Wear Bellevue Beanie - Harmaa
6856728707270,Gorilla Wear Bellevue Beanie - Vaaleanpunainen
6856728871110,Gorilla Wear Bellevue Neck Warmer - Vaaleanpunainen
6856728936646,Gorilla Wear Bellevue Neck Warmer - Valkoinen/Harmaa
6856731852998,Gorilla Wear Berea MMA Gloves
6856718549190,Gorilla Wear Bloomington Crewneck Sweatshirt - Kaikki värit
6856718680262,Gorilla Wear Bodega T-Shirt
6856729919686,Gorilla Wear Bolder Sweat Jacket
8440982077783,Gorilla Wear Bolton Windbreaker - Black
6856719007942,Gorilla Wear Boston Short Sleeve Hoodie - Kaikki värit
6856730542278,Gorilla Wear Bowie Mesh Zipped Hoodie - Kaikki värit
6856732737734,Gorilla Wear Boxer Shorts 3- Pack
6958449524934,Gorilla Wear Boxing Hand Wraps - Musta
6958449623238,Gorilla Wear Boxing Hand Wraps - Punainen
7207917256902,Gorilla Wear Boxing Reflex Ball - Musta/Punainen
7145878126790,Gorilla Wear Brandon Curry T-Shirt - Musta
6958465941702,Gorilla Wear Branson Pants - Kaikki värit
6958466597062,Gorilla Wear Branson Shorts - Kaikki värit
6958461026502,Gorilla Wear Branson T-Shirt - Kaikki värit
6958438383814,Gorilla Wear Branson Tank Top - Kaikki värit
6958530986182,Gorilla Wear Bridgeport Jogger - Kaikki värit
6958529806534,Gorilla Wear Bridgeport Zipped Hoodie - Kaikki värit
7200193609926,Gorilla Wear Brighton Crossbody Bag - Musta
6864173301958,Gorilla Wear Brooklyn Knitted Sneakers - Neon Mix
6958528889030,Gorilla Wear Bruce Men's Tights - Punainen/Harmaa
7165839245510,Gorilla Wear Buffalo Old School Workout Pants - Kaikki värit
7165842849990,Gorilla Wear Buffalo Old School Workout Shorts - Kaikki värit
7165106979014,Gorilla Wear Buffalo Old School Workout Top - Kaikki värit
6958528856262,Gorilla Wear California Mesh Shorts - Kaikki värit
6864188506310,Gorilla Wear Camo Tights - Musta/Harmaa/Vaaleanpunainen
6864174907590,Gorilla Wear Camouflage Cap - Vihreä Camo
6841600377030,Gorilla Wear Camouflage-Cap
6958485143750,Gorilla Wear Carlin Compression Short Sleeve Top - Kaikki värit
6958484750534,Gorilla Wear Carlin Compression Tights - Kaikki värit
7154716541126,Gorilla Wear Carrizo Tank Top - Kaikki värit
6958484422854,Gorilla Wear Celina Drop Crotch Joggers - Kaikki värit
6958446903494,Gorilla Wear Chester T- Shirt - Kaikki värit
6958483964102,Gorilla Wear Cheyenne T-shirt - Kaikki värit
6958437531846,Gorilla Wear Cisco Drop Armhole Tank Top - Kaikki värit
6958425964742,Gorilla Wear Cisco Shorts
6841652248774,Gorilla Wear Classic Gym Towel
6864087646406,Gorilla Wear Classic Gym Towel - Kaikki värit
6864194863302,Gorilla Wear Classic Hooded Top
6864090267846,Gorilla Wear Classic Hugetop
6864083058886,Gorilla Wear Classic Logo Cap - Musta/Harmaa
6864180281542,Gorilla Wear Classic Men's Slide
6864093216966,Gorilla Wear Classic T- Shirt - Kaikki värit
7558354010310,Gorilla Wear Classic Tank Top
6864092790982,Gorilla Wear Classic Workout Top - Kaikki värit
6846776705222,Gorilla Wear Classic-Gym-Towel-Black/White
6864096854214,Gorilla Wear Cleveland Track Jacket - Kaikki värit
6864097149126,Gorilla Wear Cleveland Track Pants - Kaikki värit
6864094200006,Gorilla Wear Cody T- Shirt
7145906798790,Gorilla Wear Colby Leggins - Kaikki värit
7145900835014,Gorilla Wear Colby Sports Bra - Kaikki värit
6864086401222,Gorilla Wear Columbia Crop Top - Kaikki värit
7200192561350,Gorilla Wear Columbus Men's Tights - Musta
8440894194007,Gorilla Wear Cooper Men's Short Tights - Black
8440897667415,Gorilla Wear Cooper Men's Tights - Black
6864178741446,Gorilla Wear Core Cap - Musta/Punainen
6841504923846,Gorilla Wear Core-Cap
7200193249478,Gorilla Wear Crew Socks - Valkoinen
7115765055686,Gorilla Wear Crew Socks 2-Pack - Kaikki värit
7558108905670,Gorilla Wear Crowley Oversized Hoodie - Kaikki värit
6864089120966,Gorilla Wear Cypress Rashguard Short Sleeve - Kaikki värit
6864092135622,Gorilla Wear Dakota Sleeveless T- Shirt - Kaikki värit
6864083321030,Gorilla Wear Dallas Wrist Wrap Gloves - Musta
6958419214534,Gorilla Wear Darlington Cap - Kaikki värit
6864094822598,Gorilla Wear Delano Polo - Kaikki värit
7265019887814,Gorilla Wear Delaware Track Jacket - Kaikki värit
7265020510406,Gorilla Wear Delaware Track Pants - Kaikki värit
6864083484870,Gorilla Wear Delta Hoodie - Kaikki värit
7184768172230,Gorilla Wear Delta Pants - Kaikki värit
6864189128902,Gorilla Wear Denver Shorts - Kaikki värit
6864093937862,Gorilla Wear Detroit T- Shirt - Kaikki värit
6864086794438,Gorilla Wear Dolores Dungarees - Kaikki värit
6864083615942,Gorilla Wear Dothan Cap - Kaikki värit
6864085123270,Gorilla Wear Drawstring Bag - Musta/Punainen
6864086892742,Gorilla Wear Drawstring Bag - Musta/Vaaleanpunainen
7200193740998,Gorilla Wear Duncan Backpack - Armeijanvihreä
6864083681478,Gorilla Wear Dunellen Tank Top - Musta/Harmaa
6864083812550,Gorilla Wear Durango Crewneck Sweatshirt - Kaikki värit
6857798942918,GORILLA WEAR E-GIFT CARD
6864090136774,Gorilla Wear Ely MMA Sparring Gloves - Musta
7265077526726,Gorilla Wear Estero T-Shirt - Kaikki värit
6864089645254,Gorilla Wear Evansville Tank Top - Kaikki värit
6846773264582,GORILLA WEAR FACE MASK
7166747377862,Gorilla Wear Felton Jacket - Kaikki värit
7060407419078,Gorilla Wear Filter Face Mask - Black
6864187457734,Gorilla Wear Florida Stringer Tank Top - Kaikki värit
6864193814726,Gorilla Wear Forbes Polo - Kaikki värit
6864193290438,Gorilla Wear Forbes Shorts - Kaikki värit
6864088563910,Gorilla Wear Forbes T-shirt  - Kaikki värit
8440943542615,Gorilla Wear Foster Softshell Jacket - Black
6864087318726,Gorilla Wear Franklin Men's Shorts
6864088072390,Gorilla Wear Franklin Men´s Tights - Kaikki värit
6864083910854,Gorilla Wear Fresno T-shirt
6864083976390,Gorilla Wear Full Leather Padded Belt - Musta
6848568983750,GORILLA WEAR full-leather-padded-belt
6864087810246,Gorilla Wear Functional Gym Towel
6864084500678,Gorilla Wear Functional Mesh Pants - Kaikki värit
6864095445190,Gorilla Wear Functional Mesh Pants - Kaikki värit
6864085024966,Gorilla Wear Functional Mesh Shorts - Kaikki värit
6848565117126,GORILLA WEAR functional-gym-towel
6864096100550,Gorilla Wear Gel Glove Wraps
6958429503686,Gorilla Wear Glendale Softshell Jacket - Kaikki värit
6864090726598,Gorilla Wear Glendo Jacket - Kaikki värit
6864091349190,Gorilla Wear Glendo Pants - Kaikki värit
7200193446086,Gorilla Wear Grip Sports Bottle - Musta
6864098099398,Gorilla Wear Gym Hybrids - Musta
6864097902790,Gorilla Wear Gym Hybrids - Musta/Ruskea
6864097444038,Gorilla Wear Gym Hybrids - Valkoinen
6864097706182,Gorilla Wear Gym Hybrids - Vihreä
7613833904326,Gorilla Wear Hailey Leggins - Kaikki värit
7613833838790,Gorilla Wear Hailey Oversized Sweatshirt - Kaikki värit
8070074892571,Gorilla Wear Halsey Track Jacket - Kaikki värit
8070081642779,Gorilla Wear Halsey Track Pants - Kaikki värit
7200190398662,Gorilla Wear Hamilton Hybrid Pants - Musta
6864189554886,Gorilla Wear Hanna Sports Bra - Kaikki värit
6864089809094,Gorilla Wear Hardcore Gloves - Musta
6864085287110,Gorilla Wear Hardcore Lifting Straps - Musta
6864096428230,Gorilla Wear Harrison Cap - Kaikki värit
6864085975238,Gorilla Wear Hayden Compression Longsleeve - Kaikki värit
6864087023814,Gorilla Wear Henderson Muay Thai / Kickboxing Shorts
6864106258630,Gorilla Wear High Tops - Kaikki värit
7200195444934,Gorilla Wear Hilton Seamless Longsleeve - Kaikki värit
7200194232518,Gorilla Wear Hilton Seamless Sports Bra - Kaikki värit
6864101900486,Gorilla Wear Hobbs T-shirt - Kaikki värit
6864111501510,Gorilla Wear Holly T- Shirt - Kaikki värit
7184807166150,Gorilla Wear Hornell Boxing Shorts - Kaikki värit
8156645228827,Gorilla Wear Hornell T-Shirt - Kaikki värit
8156612690203,Gorilla Wear Hornell Tank Top - Kaikki värit
6864106389702,Gorilla Wear Houston Tights - Vaaleanpunainen
7679350374598,Gorilla Wear Indianapolis Tank Top - Kaikki värit
7184793534662,Gorilla Wear Isabella Sweatshirt Dress - Kaikki värit
6864102097094,Gorilla Wear Jefferson Front Padded Jacket - Musta/Harmaa
8156656501019,Gorilla Wear Jefferson Shin Guards - Black
6864102392006,Gorilla Wear Jerome Gym Bag - Musta/Punainen
6864111206598,Gorilla Wear Johnson T- Shirt - Kaikki värit
8440917950807,Gorilla Wear Joliet Leggins - Black
6864113270982,Gorilla Wear Julian Cap - Kaikki värit
6864109240518,Gorilla Wear Kansas Shorts - Kaikki värit
6864111894726,Gorilla Wear Kasvomaski
6864103047366,Gorilla Wear Kaulanauha - Musta/Punainen
6864114024646,Gorilla Wear Kaycee Tights - Kaikki värit
6864108650694,Gorilla Wear Kensington MMA Fight shorts - Kaikki värit
6864102785222,Gorilla Wear Kenwood Tank Top - Kaikki värit
6841646776518,Gorilla Wear Knee Wrap
7200192397510,Gorilla Wear Knoxville 3/4 Sweatpants - Kaikki värit
6864115597510,Gorilla Wear Kokomo Flip Flops - Kaikki värit
8440915820887,Gorilla Wear Laconia Long Sleeve - Black
6864109633734,Gorilla Wear Lander Rashguard Long Sleeve
6864103178438,Gorilla Wear Laredo Flex Cap - Kaikki värit
6864103375046,Gorilla Wear Lawrence Hooded Tank Top - Kaikki värit
6864189653190,Gorilla Wear Leakey Tank Top - Vaaleanpunainen
7648005324998,Gorilla Wear Legacy Oversized Hoodie - Kaikki värit
7651501899974,Gorilla Wear Legacy Oversized Sweatshirt - Kaikki värit
7647207030982,Gorilla Wear Legacy Oversized T-Shirt - Kaikki värit
7651507011782,Gorilla Wear Legacy Shorts - Black
7647218467014,Gorilla Wear Legacy Stringer - Kaikki värit
7647994052806,Gorilla Wear Legacy Tank Top - Kaikki värit
7651506847942,Gorilla Wear Legacy Workout Pants - Black
7651505537222,Gorilla Wear Legacy Workout Top - Black
6864110092486,Gorilla Wear Lewis T- Shirt - Kaikki värit
6864103899334,Gorilla Wear Lexington Tank Top - Kaikki värit
6864103997638,Gorilla Wear Lifting Grips - Musta
